Mpox,"Direct skin contact with infected persons rash, scabs or body fluids, touching objects, fabrics (clothing, towels, bedding) and surfaces that have been used by someone with MPV or contact with respiratory secretions.","Fever, headache, muscle aches/backache, swollen lymph nodes, chills, exhaustion, respiratory symptoms (sore throat, nasal congestion, or cough), and a rash that may be located on or rear the genitals or anus but can be located other places like the hands, feet, chest, face and mouth. The rash might look like pimples or blisters and may be painful or itchy.","Roughly 1 to 2 weeks. If flu- like symptoms develop, they usually develop a rash 1 to 4 days later.","From onset of prodrome until the rash has healed, all scabs have fallen off and a fresh layer of skin has formed. This illness typically lasts 2 to 4 weeks.
Prodrome of fever, malaise, headache sometimes sore throat and cough, and lymphadenopathy usually occurs 1-2 days before rash
onset.","Exclude until the rash has healed, all scabs have fallen off and a fresh layer of skin has formed.","As soon as possible, within 24 hours.",
MRSA (Methicillin-resistant Staph aureus) skin infections,"Direct skin contact with infected person, wound drainage or contaminated surfaces; increase
risk in crowded conditions;","Skin lesions such as furuncles (abscessed hair follicles or “boils”),
carbuncles (coalesced","Variable, usually 4-10 days and up to
months; at","Duration of acute illness if wound drainage present
Draining wounds are",Exclude if wound drainage cannot be well contained under a dressing,"Individual cases are not reportable.
Clusters of 2 or more cases with infections in a",['http://www.cdc.gov/mrsa/index.html']
,occasional transmission by droplet over short distances,"masses of furuncles), and abscesses; may have purulence (pus), yellow/white central point, redness",times initially mistaken as spider bite,very contagious and should be covered at all times.,"Exclude from high-risk activities such as contact team sports if wound cannot be completely covered with a secure bandage that will remain intact throughout sport activity, until completely healed
Exclude from use of pools/whirlpools, etc. until wounds are healed",14-day period and with an epidemiological link should be reported to local health department.,"['http://www.cdc.gov/mrsa/community/schools/index.html', 'http://www.cdc.gov/mrsa/community/team-hc-providers/index.html', 'http://ilga.gov/commission/jcar/admincode/077/077006900D06580R.html']"
Molluscum contagiosum,Person to person close contact; through sharing of objects such as towels,Small flesh colored bumps on the skin that may have a tiny indented center,"2 to 7 weeks, as long as 6 months",When lesions are present; otherwise unknown,"No exclusion.
Provide education on importance of hand hygiene and avoiding scratching areas.","Individual cases are not reportable.  Clusters of cases should be reported to local health
department.",
"Ringworm  (e.g. tinea corporis, tinea capitis)","Direct skin contact with infected person or animal, or contact with surfaces or objects contaminated with fungal spores","Skin: red circular patches with raised edges and central clear area; cracked peeling skin between toes;
Scalp: redness, patchy scaly areas with/without hair loss
Can occur in multiple sites on the body","Typically 4 to
14 days after exposure",From onset of lesions until treatment begins and lesion begins to shrink,"If lesion can be kept covered, exclusion are not required.
If lesions can NOT be kept covered, exclude from school until 24 hours after treatment begins.",Individual cases are not reportable.  Clusters of cases should be reported to local health department.,['http://www.cdc.gov/fungal/diseases/ringworm/index.html']
Scabies,Prolonged skin-to-skin contact with infested individual; contact with bedding or clothes of infested person,"Red bumps commonly found in skin folds; burrows appear as tiny whitish or gray lines on skin surface; intense itching, especially at night","4 to 6 weeks,
1 to 4 days after re- exposure",From up to 8 weeks before skin rash appears until it has been treated with a scabicide,"Exclude from school and other extracurricular activities until the morning after treatment recommended by the child’s healthcare provider has been started.
Childcare rules: exclude until the morning after the first treatment.
http://www.ilga.gov/commission/jcar/adminc ode/089/089004070G03100R.html",Individual cases are not reportable.  Clusters of cases should be reported to local health department.,
Shingles/Zoster,Direct contact with the rash during blister phase,"Painful rash that develops typically on one side of the body; may have fever, headache, chills, nausea",None. Anyone with history of chicken pox can develop shingles.,"Shingles cannot be passed from one person to another, but during the blister phase of rash, direct contact with blister fluid of shingles rash can cause chicken pox in non-immune persons.  When crusted over, rash is no longer infectious.","Exclude if rash cannot be covered, or if child cannot comply with keeping rash covered until crusted over. Exclude if febrile or other symptoms meeting illness exclusion criteria are present",Individual cases are not reportable.  Clusters of cases should be reported to local health department.,
Bat Exposures/Animal Bites (Potential for Rabies),"Contact with an infected animal’s
saliva through a bite or scratch in the skin, or through mucous","In animals, behavior
changes may occur, including seeing","Humans:
symptom onset usually","When the virus
reaches the saliva of the infected animal",No exclusion.,Report potential human exposure to rabies as,
