Doença,Detalhes
Atherosclerosis,"//What is it?// Atherosclerosis is a particular type of arteriosclerosis, very common, which mainly affects the large vessels and which is the basis of the most common arterial diseases, such as arterial hypertension, coronary disease, aortic aneurysm or arterial disease of the lower limbs. This aspect is very important because it is known that pathologies of the circulatory system are responsible for the main causes of death in Portugal. Atherosclerosis is a disease of the large and medium-sized elastic arteries and muscular arteries, and is characterized by the presence of lesions that resemble plaques (atheromas). This pathology mainly affects the outer margins of arterial bifurcations and branches, where blood flow is most turbulent. It is a general disease that can affect different organs. When the artery wall is subjected to different forms of aggression, local accumulation of lipoproteins and migration of inflammatory cells occurs, with abnormal proliferation of some cellular elements in the inner layers of the arteries. This process leads to a progressive narrowing of the arterial caliber and tends to affect the elastic characteristics of the vessels. It begins at a young age and has a long silent gestation period, which is why it is necessary to adopt preventive measures to control risk elements during childhood and adolescence. //Symptoms// Atherosclerosis usually does not cause any symptoms until the blood supply to an organ is reduced. When this happens, the manifestations vary, depending on the specific organ involved. In fact, the signs of atherosclerosis are very variable. Some patients with a mild type may present with a serious illness, such as an acute myocardial infarction or sudden death. In contrast, other patients with more advanced disease may show few signs. Its different manifestations result from a generalized clinical process that can involve different vascular territories: cerebral, coronary and peripheral arteries. For this reason, the symptoms vary according to the arterial vascular territory involved. Cerebrovascular disease may appear as a transient ischemic attack, if there is complete regression of neurological symptoms and signs in less than 24 hours, or a stroke. Coronary vascular disease can become known in several ways, such as an acute coronary syndrome, stable or unstable angina pectoris, and acute myocardial infarction. Peripheral arterial disease produces several signs that range from intermittent claudication to pain at rest. Narrowing of the leg arteries causes cramp-like pain in the leg muscles, especially during exercise. If the narrowing is severe, there may be pain at rest, fingers and feet may become cold, pale or bluish, and hair loss may occur on the lower limbs. As noted, the progressive narrowing of the artery lumen caused by the expansion of the atheromatous plaque leads to a gradual obstruction of blood flow. When it reaches 50% to 70% of the vessel diameter and/or when there are increased metabolic or oxygen needs, symptoms of low output, angina pectoris or intermittent claudication appear. Rupture of an unstable atherosclerotic plaque, exposing its contents, can lead to thrombosis with total obstruction of the artery involved. This can result in unstable angina, acute myocardial infarction, transient ischemic attack or stroke. Other clinical manifestations include erectile dysfunction, development of aneurysms and chronic renal failure. When atherosclerosis affects circulation in the abdominal region, a dull or cramp-like pain may occur in the middle of the abdomen, usually starting 15 to 30 minutes after a meal. Complete blockage of an intestinal artery causes severe abdominal pain, sometimes accompanied by vomiting, diarrhea or an increase in abdominal volume. //Causes// Factors that increase the risk of atherosclerosis include: High levels of cholesterol in the blood;/ Low levels of HDL cholesterol (the “good cholesterol”);/ Elevated levels of C-reactive protein (a marker of inflammation);/ High blood pressure;/ Diabetes;/ Family history of coronary heart disease at an early age;/ Smoking;/ Obesity;/ Physical inactivity;/ Advanced age;/ //Diagnosis// Medical examination may be useful in detecting its signs, such as the presence of lipid deposits in the eyelids or tendons, carotid bruits, decreased peripheral arterial pulses, palpable and pulsatile abdominal masses, neurological signs, peripheral cyanosis, gangrene, hypotension, tachycardia. Diagnosis is based on clinical history, including current symptoms and current medications, and medical examination. Laboratory tests are important, as is an electrocardiogram or echocardiogram. Other studies may be necessary to assess blood circulation in the heart, brain, and legs. Ultrasound measurement of the thickness of the intima and media layers of the carotid arteries has been considered a test with great potential for noninvasive assessment of the disease. //Treatment// There is no cure, but treatment can slow the progression or even stop it from getting worse. The main goal of treatment is to prevent significant narrowing of the arteries so that symptoms never develop and vital organs are never damaged. To achieve this, you must start by having a healthy lifestyle. It is also important to diagnose and treat all risk factors for its development, such as cholesterol and high blood pressure. Once organ damage related to atherosclerosis has developed, treatment depends on the organ involved. There are currently effective medications available to control coronary heart disease, transient ischemic attacks and peripheral arterial disease. These treatments may be purely drug-based or involve surgery. //Prevention// It is possible to help prevent atherosclerosis by changing the risk factors for the disease. You should practice a lifestyle that promotes good circulation, avoiding smoking, maintaining a healthy weight and diet rich in vegetables and fruit, practicing regular exercise, controlling high blood pressure, diabetes and cholesterol. Regular physical exercise can bring many benefits to the health of cardiovascular patients. But you should consult your doctor. Hypertension, stroke, dementia, osteoporosis, excess weight. Excess salt can increase the risk of several diseases. The key is moderation. It is important in diagnosing heart problems and should be done regularly from a certain age. Learn the step-by-step process of an electrocardiogram. About us;/ Events;/ Clients and Companions;/ News;/ CUF Academic Center;/ Partnerships;/ Contacts;/ Frequently Asked Questions;/ Join us;/ Virtual Visit;/ English version;/ My CUF;/ Access Solutions and Health Plans;/ Facebook;/ Facebook Instagram;/ Instagram LinkedInCreated with Sketch.;/ LinkedIn Youtube;/ Youtube award4;/ award4 certification1;/ certification1 certification2;/ certification2 certification3;/ certification3 Complaints and compliments;/ Complaints and compliments Privacy and Cookies Policy;/ Terms and Conditions;/ Whistleblower Channel;/ © CUF 2024 All rights reserved Home;/ Health A-Z: Diseases, Symptoms and Treatments;/"
Global developmental delay,"//What is it?// Global developmental delay (AGD) is a neurodevelopmental disorder that occurs at an early age in a child's development and can become chronic throughout life. From birth, children develop according to stages of psychomotor development that are characteristic of all children. Therefore, there are developmental milestones that must be achieved at specific target ages. When these stages are not achieved, we are possibly facing a developmental delay. Developmental delay is different from maturational delay, in that the deviation in the acquisition of the developmental milestone is more significant in temporal terms. //Symptoms// Global developmental delay refers to a delay in at least two of the areas of child development: verbal cognition, non-verbal cognition, language, gross motor skills, fine motor skills or autonomy. This delay can be noticed early, for example when the child fails to start walking within the ideal time for acquiring walking skills (after 18 months) or when he/she does not acquire his/her first words until 18 months. The baby/child's behaviour is also often different when compared to babies/children of the same age, and may be excessively active, sullen, inattentive, or on the contrary, very passive, uncommunicative and with little reaction to stimuli from the environment and interaction with people. //Causes// The global delay in psychomotor development results from atypical intellectual and adaptive development with an early origin, and can be a consequence of multiple causes (prenatal, perinatal or postnatal). The etiological diagnosis remains unknown in 50-80% of all situations. As a disorder with a genetic cause, it is heterogeneous.  In addition to its clinical variability, it can occur sporadically or be hereditary. Numerous factors are involved in the genesis of AGD: genetic, educational, cultural, traumatic, emotional and socioeconomic. Genetic research may help identify the cause, especially in cases of moderate to severe AGD. //Diagnosis// The diagnosis of AGD is based on the existing delay in psychomotor development in more than one domain (cognition, motor, autonomy, language, fine motor skills, verbal cognition, attention, behavior). This delay should ideally be quantified in Psychology consultations through the application of psychometric tests, information from the child's and family's and school history data. In addition to AGD, it will be important to check whether there are other comorbid neurodevelopmental disorders, such as a language disorder or attention deficit/hyperactivity disorder. This diagnosis can be made during the first two years of life and up to 5 years of age. From this age onwards, the most appropriate nomenclature for a situation of this type may be intellectual development disorder. For this diagnosis, a Neurodevelopmental Pediatrics consultation should also be carried out so that other clinical causes can be excluded, comorbidity identified and to guide the etiological investigation of the situation. Genetic consultation is normally recommended, especially in more severe cases, or in the presence of phenotypic changes, to attempt to identify the etiological cause. //Treatment// AGD has a major impact on the life of the affected person as well as their family and society, which is why its timely diagnosis is essential so that timely intervention/treatment can be initiated. Intervention in AGD must be multidisciplinary, since this delay affects more than one area of ​​development. Therefore, an intervention program must be created that includes specialties such as Psychology, Psychomotricity, Speech Therapy, Occupational Therapy or Music Therapy. The number of hours allocated to the program depends on the child's age, the severity of the delay and the individual profile, but in general, the ideal would be a more intensive intervention in the first phase (1h/day) so that deficits can be overcome as soon as possible. as quickly as possible. In addition to specialized technicians, educators must also be included, so that school integration must be early, as well as parents. Parents must be an active element, and must be guided with parental strategies on the best way to encourage their child towards the objectives defined in the intervention programs. This work must be coordinated between everyone involved. //Prevention// Many causes of intellectual disability are not preventable. However, numerous strategies must be implemented to detect and diagnose treatable causes early (such as hypothyroidism and phenylketonuria), reduce the risks of intellectual development disorder, minimize sequelae, and improve children's function and prognosis.Primary prevention aims to prevent conditions that could cause intellectual disability. Examples of interventions are: Avoid prenatal exposure to alcohol, drugs and other teratogenic agents;/ Use of prenatal vitamin and mineral supplements, including folic acid;/ Adequate prenatal surveillance;/ Differentiated perinatal care;/ Extended prenatal screening test (heel prick test);/ National vaccination program;/ Use of restraint system and appropriate automobile transport;/ Prevention of road, domestic and leisure accidents and other traumas;/ Prevention of traumatic brain injuries.;/ Early, adequate and timely genetic study and counseling must be carried out in all suspected cases. There are also two other levels of prevention: secondary and tertiary. Secondary prevention, encompasses the specific treatment of conditions with the aim of reducing the risk of AGD and improving the prognosis, and tertiary prevention, brings together interventions that aim to optimize children's function and quality of life. American Psychiatric Association (2013). “Diagnostic and statistical manual of mental disorders: DSM-5 (fifth edition)”. American Psychiatric Publishing Inc, Washington DC. Nascimento, C. & Bandeira de Lima, C. (2015). Global Delay in Psychomotor Development/Intellectual Development Disorder. In Neurodevelopmental Disorders. (pp. 24-57), 1st edition. Lidel. Regular health surveillance in children and adolescents encompasses interventions and procedures that have as their ultimate objective the promotion of health in this age group In the context of children's language development, active family participation is essential. What are the best communication strategies? Practicing sports aims to develop psychomotor potential, and is also a factor of socialization, through coexistence and teamwork. About us;/ Events;/ Clients and Companions;/ News;/ CUF Academic Center;/ Partnerships;/ Contacts;/ Frequently Asked Questions;/ Join us;/ Virtual Visit;/ English version;/ My CUF;/ Access Solutions and Health Plans;/ Facebook;/ Facebook Instagram;/ Instagram LinkedInCreated with Sketch.;/ LinkedIn Youtube;/ Youtube award4;/ award4 certification1;/ certification1 certification2;/ certification2 certification3;/ certification3 Complaints and compliments;/ Complaints and compliments Privacy and Cookies Policy;/ Terms and Conditions;/ Whistleblower Channel;/ © CUF 2024 All rights reserved Home;/ Health A-Z: Diseases, Symptoms and Treatments;/"
Stroke stroke,"//What is it?// Cerebrovascular accident (CVA) is the main cause of death in Portugal. Worldwide, it is estimated that: one in six people will have a stroke; every second someone suffers this illness; and every six seconds this disease is responsible for someone's death. Each year, 15 million suffer a stroke and, of these, six million do not survive. According to the Portuguese Stroke Society, Portugal is, in Western Europe, the country with the highest mortality rate, especially in the population under 65 years of age. Stroke results from damage to brain cells, which die or stop functioning normally, due to the lack of oxygen and nutrients following a blockage of blood flow (ischemic stroke) or because they are flooded with blood from an artery that connects. ruptures (hemorrhagic stroke). Ischemic patients account for around 4/5 of the total. Brain cells die soon after this injury occurs. However, it can last a few hours if the blood flow is not completely stopped. For this reason, it is essential to act quickly to minimize brain damage. There is also another form of shorter duration, less than 24 hours, which is called a transient ischemic attack (TIA). In these cases, the blockage of the cerebral artery is momentary and symptoms can last for a few minutes or hours. It is important to emphasize that, even in temporary cases, it is essential to go to the hospital, as a TIA can be the first sign of a stroke with devastating consequences. In fact, one in five people who experience a TIA will suffer an extensive stroke within the next three months. You should never ignore an AIT. It is still common to designate stroke as “thrombosis”. //Symptoms// Since the brain controls bodily functions, its signals will vary depending on the area affected. For example, if a stroke affects the area that controls body movement on the right side, that side will have reduced mobility. Since the brain also controls more complex mental processes, such as communication, emotions, reasoning and thinking, all of these functions are likely to be affected after a stroke. As it occurs suddenly, due to the occlusion or rupture of an artery, its effects on the body are immediate. //Causes// There are numerous risk factors, and the greater the number, the greater the risk of a stroke. Some of these factors cannot be controlled, such as age, gender (more common in men) and genetics. Regarding age, it is important to note that around 25% of strokes occur in young people. Diabetes, high blood pressure, cholesterol, obesity, a sedentary lifestyle, arrhythmias, fibromuscular dysplasia, tobacco and alcohol consumption also increase the risk. //Diagnosis// It's simple to recognize a stroke using the five F's rule. These symptoms can appear alone or in combination: Face: may suddenly become asymmetrical with one of the eyelids drooping. These signs can be better noticed if the affected person tries to smile.;/ Strength: It is common for an arm or leg to suddenly lose strength or for a sudden loss of balance to occur.;/ Speech: may sound strange or incomprehensible and speech may not make sense. Often, the patient does not seem to understand what is being said to him or her.;/ Sudden lack of vision: in one or both eyes, is a common symptom, as is double vision.;/ Severe headache: it is also important to assess a sudden and very intense headache, different from the usual pattern and with no apparent cause.;/ //Treatment// The most useful medications for the treatment and prevention of stroke are antihypertensives, antiplatelet agents and anticoagulants. Altogether, these three classes of medications improve circulation and ensure better flow of blood, oxygen and nutrients to brain cells. The choice of drug combination should always be made by the doctor. In some cases, surgery may be essential to unblock a clogged artery.  //What is the recovery after a stroke?// About a third of patients recover significantly within the first month, but many patients will experience lifelong after-effects. Recovery will depend on the location and extent of the stroke, but also on the time that has passed, which is why it is crucial to go to hospital immediately if there is a suspicion that it has developed. Physiotherapy and lifestyle changes are important aspects of rehabilitation. Maintaining a positive attitude and professional and family support are also essential to ensuring that everything goes as smoothly as possible.  //What are the consequences of a stroke?// They will depend on the type of stroke, the location of the artery affected, the area of ​​the brain affected, and the state of health and activity prior to the episode. All strokes are different and each person affected will have different problems and needs. //Prevention// It is important to monitor all aspects of your health, by regularly checking your blood pressure and cholesterol, not smoking or consuming excessive amounts of alcohol or salt, maintaining a healthy diet and exercising.  //What to do if you suspect a stroke?// In these cases, it is essential to call 911 immediately, explaining everything that is happening. The patient will be treated as a priority in an Emergency Room where treatment will be promptly instituted and the diagnosis made. Stroke Association Stroke Foundation Centers for Disease Control and Prevention Living after a Stroke - Recommended for Informal Care Providers, Directorate-General for Health, Lisbon, 2000 Brazilian Society of Cardiology Portuguese Cerebrovascular Accident Society Load more;/ There are several ways to reduce your risk of stroke, or at least minimize the consequences, by recognizing the signs and asking for help quickly. Prosopagnosia consists of the inability to recognize other people's faces, including friends. Find out more about this neurological change. Although there are risk factors common to both men and women, women have a higher risk of suffering a stroke than men. Find out why. About us;/ Events;/ Clients and Companions;/ News;/ CUF Academic Center;/ Partnerships;/ Contacts;/ Frequently Asked Questions;/ Join us;/ Virtual Visit;/ English version;/ My CUF;/ Access Solutions and Health Plans;/ Facebook;/ Facebook Instagram;/ Instagram LinkedInCreated with Sketch.;/ LinkedIn Youtube;/ Youtube award4;/ award4 certification1;/ certification1 certification2;/ certification2 certification3;/ certification3 Complaints and compliments;/ Complaints and compliments Privacy and Cookies Policy;/ Terms and Conditions;/ Whistleblower Channel;/ © CUF 2024 All rights reserved Home;/ Health A-Z: Diseases, Symptoms and Treatments;/"
