Doença,Detalhes
Osteoarthritis,"//What is it?// Osteoarthritis is one of many rheumatic diseases and is by far the most common. It is a degenerative pathology that involves the entire joint. The word osteoarthrosis means degeneration of the joint. Osteoarthritis, commonly called osteoarthritis, is a disease that fundamentally affects articular cartilage, which is an elastic connective tissue found at the ends of bones that articulate with each other. Articular cartilage is nourished by joint fluid or synovial fluid, so called because it is produced by the synovium, a membrane rich in vessels that lines the interior of the joints. This liquid helps to lubricate the joint, facilitating its movements, and allowing the cartilages in healthy joints to slide over each other without friction, that is, without wear. In osteoarthritis, cells (chondrocytes) die and produce fewer proteoglycans and collagen. As a result of this, the articular cartilage ulcerates and the bone underneath the cartilage reacts, thickening and giving rise to bone excrescences called osteophytes. These are known as “parrot beaks”, because some of them, on x-rays, give images that resemble the beak of this animal. In this degenerative process, joint inflammation phenomena often occur, which causes pain and increased joint volume. Hence the term “arthritis” is also used for these clinical conditions. Osteoarthritis is not synonymous with joint aging (there are elderly people without osteoarthritis and young adults with this disease), although it is more common in older individuals who, naturally, have had more years to wear out their joints. Osteoarthritis is the most common pathology and will continue to increase, given its association with aging. In Portugal there are around half a million patients with osteoarthritis and pain, although, in fact, this number is close to one million, as many have osteoarthritis and have no complaints. In fact, over the age of 60, 90% of people have osteoarthritis. The disease is rare before the age of 40 but, from then on, it becomes increasingly common. The association with age is very evident, largely because the risks that cause the problem accumulate and because older joints have more difficulty adapting and regenerating compared to younger ones. Osteoarthritis is a very important cause of disability in the elderly and one of the most common causes of permanent disability and early retirement. The disease affects both genders equally, although after the age of 50 there is a slight predominance in women. It is a pathology that appears in all climates and in all races. The environment is not a cause of osteoarthritis, although cold and humidity worsen these patients' complaints, and hot weather relieves pain. There are joints in which osteoarthritis is more common: the knees, hands, hips, spine and feet. In the hands, the joints of the fingers and, in the wrist, at the base of the thumb are the most common. In the spine is the cervical and lumbar region. On the feet it is the base of the first toe, which when deformed is often called a “bunion”. In Portugal, the joints most frequently involved are the spine, in particular the cervical and lumbar segments, the knees, the joints of the hands and the base of the big toe. On the contrary, those on the wrists and ankles are rarely affected by osteoarthritis. //Symptoms// There is no correlation between the degree of joint damage and the intensity of pain. Many patients have advanced osteoarthritis and little pain, while others complain a lot even though their osteoarthritis is not very advanced. The main symptoms are pain, stiffness, limitation of movement and, in more advanced stages, deformities. The pain has a rhythm characterized by the fact that it worsens throughout the day, with movement and effort, and improves when the patient rests, especially when lying down. As a rule, patients with osteoarthritis do not have pain at night and sleep well, although in very advanced cases of osteoarthritis of the hips and knees, pain may also appear during the night. Complaints relating to osteoarthritis generally evolve very slowly and sometimes in spurts. This means that patients can go for months or years without symptoms. The most common signs are joint pain during use of the joint, particularly when there is overload. Short-term pain or stiffness may also occur when starting to move after a period of inactivity. The limitation of mobility progressively worsens as the disease progresses. Periods of swelling of the joint may occur due to inflammation. This situation takes the form of nodules on the fingers of the hands and fluid can accumulate on the knees, which coincides with a worsening of the complaints. During the course of the disease, the joint increases in size, which is common to notice in the knees or fingers. Pain is not always located at the level of the diseased joint. In hip osteoarthritis (coxarthrosis), the pain, which is almost always located at the level of the groin and radiates down the anterior surface of the thigh to the knee, can appear exclusively at the level of this last joint. In other words, the patient has pain in the knee and the osteoarthritis is located in the hip. This pain is called referred pain. The pain is often radiated, as happens, for example, with pain in the lumbar spine and cervical spine. In fact, in low back pain the pain can spread to the lower limbs and in neck pain it can be felt in the head, chest and upper limbs. Stiffness appears, above all, when starting movements, for example, in patients who are sitting and getting up, and also in the morning when waking up. The stiffness of osteoarthritis is short-lived, lasting no more than 30 minutes. Limitation of movement can appear early, unlike what happens with deformations, which, as a rule, occur late. Limited movement can cause great disability in these patients. For example, patients with osteoarthritis in the upper limbs, particularly in the shoulders, may have great difficulty getting dressed and eating. On the other hand, osteoarthritis in the lower limbs can make walking difficult and make certain tasks such as putting on shoes difficult or even impossible. Joint deformities sometimes take the form of nodules of bone consistency, as occurs in the hands, more specifically in the joints of the fingers. Unlike inflammatory rheumatic diseases, arthrosis is a condition that affects only the joints, does not affect the internal organs and is not accompanied by other symptoms such as fever, lack of appetite, fatigue and weight loss. During the process, the cartilage becomes worn down, becoming thinner and gradually more destroyed. As it is essential for the movement of the joint, the pain becomes more intense and movements become increasingly compromised. The pain prevents mobility, resulting in muscle atrophy. The joint becomes unstable, unable to perform its function, without cartilage, and with the bone developed around its periphery. Patients become increasingly limited, to the point where they are unable to move the joint without great effort and with severe pain. //Causes// All those who expose their locomotor system to overloads or excessive work – such as athletes and obese people, and those who have malformations of the joints or limbs, such as deformities of the knees, hips or feet – will tend to develop the problem more early. Some professions can cause osteoarthritis more frequently in certain joints. For example, footballers have more osteoarthritis in their knees (gonarthrosis), ballet dancers in their ankles, construction workers (who use pneumatic hammers) in their elbows, and dockworkers in their spine (spondyloarthritis). Osteoarthritis can be primary and secondary. The primary ones do not have a known cause, unlike the secondary ones which may be due to trauma, in particular repeated microtrauma, the incongruity of the articular surfaces, old fractures, infectious, inflammatory and metabolic diseases that have previously affected the cartilage. Primary osteoarthritis is more common in women, affects small joints more often and is more common in certain families than others. Secondary osteoarthritis tends to involve large joints. The causes of osteoarthritis are multiple. In general, overloading a normal joint or normal use of a diseased joint are the causes of osteoarthritis. Thus, it is common to encounter traumas in the past (large or small, these are usually very repeated), such as those resulting from sporting or professional activities, being overweight, as well as other rheumatic diseases or malformations that have previously deteriorated the joints. However, there are many cases in which no cause is apparent or in which only heredity is identified. //Diagnosis// Contrary to what occurs in inflammatory rheumatic diseases, osteoarthritis does not lead to changes in blood and urine tests. Radiographs in these patients are very typical, showing a reduction in the joint space, that is, the space between the two articulating bones, sclerosis of the subchondral bone, that is, reinforcement of the bone located underneath the articular cartilage, and osteophytes also called “parrot beaks”. //Treatment// Osteoarthritis has no cure, and the patient should know this, but its treatment can allow the maintenance of a completely normal life in most cases. The objectives of therapy are to alleviate and, if possible, suppress pain, improve functional capacity, that is, increase the mobility of affected joints, prevent atrophy of the muscles related to said joints and, finally, prevent the worsening of existing injuries. . Osteoarthritis cannot be treated with medication and physiotherapy alone. The patient's commitment is essential and without it the treatment plan will not be successful. The basic treatment measures include patient education, relative rest and an exercise plan. Education should include teaching the general rules for protecting the locomotor system and correcting posture. In fact, incorrect postures trigger and/or aggravate pain and lead to excessive support on areas of the articular cartilage, which will therefore wear out more in these areas. Here are some examples of general principles that may be useful in controlling or preventing osteoarthritis: sleeping on a hard bed, preferably on your back; do not sleep with a pillow; do not remain in the same position for a long time, especially in standing or sitting positions, in order to reduce the burden on the spine, in particular the lumbar spine, hips and knees; do not use sofas or armchairs that deform the spine, preferably a hard chair, with the back well supported and the feet firmly placed on the floor; keep your neck extended and never flexed; avoid picking up heavy objects, to avoid overloading the spinal joints; avoid flexing the vertebrae, and whenever it is necessary to pick up an object from the floor, it is important to bend your knees; wear simple, practical clothes and shoes with sturdy heel counters and low heels. In some cases, the doctor may need to temporarily prescribe devices that limit joint mobility, such as a cervical collar or an orthopedic belt. Patients with osteoarthritis, who are almost always elderly, often suffer from other health problems (obesity, diabetes, hypertension, etc.) and these conditions must be well controlled. In addition to pain, it is important to monitor inflammation. In more advanced forms of the condition, joint prostheses may be fitted. Symptomatic treatment is based on general joint protection measures, such as rest, rules for lifting and carrying loads and the use of physical agents (ice, heat through hot water or infrared and drugs).  Medications for these cases are analgesics such as paracetamol and, in more serious situations, in combination with weak opioids. Non-steroidal anti-inflammatories are also used which, although they must be administered with precautions, can be very useful in controlling signs of inflammation. In addition to oral forms, topical forms can also be effective, especially if applied repeatedly and to superficial problems where penetration of the medicine can be ensured. Sometimes, intra-articular injections of hyalorunans (derivatives of hyaluronic acid present in cartilage and synovial fluid) can be used, which can provide relief to the patient for several months, and injections with corticosteroids into peri-articular structures (tendons, ligaments, synovial bags) which often become inflamed causing severe symptoms. In addition to symptomatic treatment, it is of utmost importance to try to prevent the progression of the disease. There are drugs taken orally that, in addition to alleviating the symptoms of the problem, have a proven effect on delaying the progression of knee osteoarthritis, such as glucosamine sulfate and chondroitin sulfate. Muscle relaxants are used when muscle contracture is the cause of pain or contributes to its worsening, as happens, for example, in acute attacks of lumbago, sciatica, or torticollis. Orthopedic surgery, by correcting deviations and deformations but above all by performing arthroplasties, that is, placing joint prostheses to replace those that are already very deteriorated, constitutes an important therapeutic advance, almost always with very satisfactory results. //Prevention// To be able to delay the progression of osteoarthritis, all measures that avoid overload or misuse of the joint are essential, such as maintaining a healthy weight or inhibiting certain professional or recreational activities. It is likely that controlled physical exercise, in addition to improving symptoms, will also facilitate mobility or delay the worsening of the disease. Mayo Foundation for Medical Education and Research, Julho de 2013 Portuguese Society of Rheumatology, 2012 M. H. Atkinson, Osteoarthrosis, Can Fam Physician. 1984 July; 30: 1503–1507 Mário Viana de Queiroz, Rheumatic Diseases, 2009 F. Berenbaum, Osteoarthritis as an inflammatory disease (osteoarthritis is not osteoarthrosis!), Osteoarthritis and Cartilage, Vol. 21 (1): 16-21, Jan. 2013 Load more;/ Having a cast on your arm or leg helps you recover from fractures and reduces pain. Know what to do in this situation. A dislocation occurs when bones in a joint, such as the shoulder or knee, are displaced from their normal position. Learn about treatment options. The purpose of crutches is to reduce the weight exerted on the lower limbs. Learn how to use crutches in different everyday situations. About us;/ Events;/ Clients and Companions;/ News;/ CUF Academic Center;/ Partnerships;/ Contacts;/ Frequently Asked Questions;/ Join us;/ Virtual Visit;/ English version;/ My CUF;/ Access Solutions and Health Plans;/ Facebook;/ Facebook Instagram;/ Instagram LinkedInCreated with Sketch.;/ LinkedIn Youtube;/ Youtube award4;/ award4 certification1;/ certification1 certification2;/ certification2 certification3;/ certification3 Complaints and compliments;/ Complaints and compliments Privacy and Cookies Policy;/ Terms and Conditions;/ Whistleblower Channel;/ © CUF 2024 All rights reserved Home;/ Health A-Z: Diseases, Symptoms and Treatments;/"
Shoulder osteoarthritis,"//What is it?// Shoulder osteoarthritis corresponds to wear and tear of the shoulder joint, with progressive loss of cartilage and bone deformity, with the appearance of osteophytes (""parrot's beak"") or elevation of the head of the humerus from its position in the joint. It can occur primarily or secondary to trauma, ruptures of the rotator cuff tendons, rheumatic diseases, etc. //Symptoms// Shoulder osteoarthritis is associated with pain and loss of function, manifested by decreased mobility, especially in lifting and rotating movements. //Diagnosis// The initial diagnosis is made through X-ray, and should be complemented by CT or MRI. //Treatment// In the initial phase, analgesics and anti-inflammatories may be prescribed, which, together with an appropriate physiotherapy plan, provide pain relief and improve joint function, although they do not treat osteoarthritis. In cases where conservative treatment fails, shoulder prosthesis (joint replacement or arthroplasty) is indicated. Load more;/ Having a cast on your arm or leg helps you recover from fractures and reduces pain. Know what to do in this situation. A dislocation occurs when bones in a joint, such as the shoulder or knee, are displaced from their normal position. Learn about treatment options. The purpose of crutches is to reduce the weight exerted on the lower limbs. Learn how to use crutches in different everyday situations. About us;/ Events;/ Clients and Companions;/ News;/ CUF Academic Center;/ Partnerships;/ Contacts;/ Frequently Asked Questions;/ Join us;/ Virtual Visit;/ English version;/ My CUF;/ Access Solutions and Health Plans;/ Facebook;/ Facebook Instagram;/ Instagram LinkedInCreated with Sketch.;/ LinkedIn Youtube;/ Youtube award4;/ award4 certification1;/ certification1 certification2;/ certification2 certification3;/ certification3 Complaints and compliments;/ Complaints and compliments Privacy and Cookies Policy;/ Terms and Conditions;/ Whistleblower Channel;/ © CUF 2024 All rights reserved Home;/ Health A-Z: Diseases, Symptoms and Treatments;/"
Osteoarthritis of the thumb,"//What is it?// Osteoarthritis is a disease that causes inflammation, stiffness and destruction of joints. In a normal joint, cartilage covers the bone ends, allowing them to move smoothly and without pain. The joint at the base of the thumb is formed by one of the carpal bones (trapezium) and the first of the three thumb bones (metacarpal). This joint (trapezium-metacarpal) allows the thumb to move and grip with the other fingers. In osteoarthritis, the cartilage layer deteriorates and the bones rub against each other. It often affects the joint at the base of the thumb, also called the trapezium-metacarpal joint. Trapeziometacarpal osteoarthritis (rhizarthrosis) slowly destroys the joint. Rhizarthrosis is more common in women over 40, but anyone can have it. It usually affects both thumbs.  //Symptoms// The most common symptom is pain at the base of the thumb. It can be felt when you pick up an object between your thumb and fingers, when you try to open a door, turn a lock or when you drop something. The pain can also worsen over time. The joint can become inflamed and become increasingly stiff or deformed. //Causes// The tops of the bones are covered with cartilage. This covering acts as a cushion, allowing the bones to move smoothly. Osteoarthritis destroys the cartilage and the bones start to move against each other when the thumb is moved, making the joint inflamed and painful. Over time, the bones can collapse or dislocate, causing deformation and stiffness that prevents the finger from being straightened. Trapeziometacarpal osteoarthritis results from wear and tear of the joint. It is more common in younger people if there has been trauma with ligament damage or a fracture of the thumb. Repetitive pinching, twisting or rolling movements between the thumb and fingers can aggravate osteoarthritis. //Diagnosis// The doctor can diagnose it by the deformation and mobility of the thumb. He or she may also order an X-ray to see the degree of destruction of the joint. Treatment will depend on the pain and the degree of joint involvement. //Treatment// Non-surgical treatment If arthritis is diagnosed at an early stage of the disease, it may respond favorably to non-surgical treatment. Your doctor may place a splint to immobilize your thumb for a period of three to six weeks. This limits movement and reduces inflammation. It may be associated with the oral intake of an anti-inflammatory drug, such as Aspirin or Voltaren. If symptoms do not improve, your healthcare provider will consider a joint injection of an anti-inflammatory drug, such as cortisone. If non-surgical treatment does not relieve pain and stiffness, or if the arthritis is already at a more advanced stage with joint destruction, the doctor may recommend consultation with a hand surgery specialist to assess the situation and which technique is best. correct for each case.  Surgical treatment If the hand surgeon recommends surgery, the diseased joint will be removed, usually by removing the base of the first metacarpal and trapezium. Reconstruction is performed using a prosthesis or a tendon graft taken from the forearm and wrist. This type of surgery can be performed under general anesthesia (which requires a 24-hour hospital stay) or under local regional anesthesia of the branchial plexus, in which only the arm is anesthetized (which does not require hospitalization).  The recovery Initially the hand has a relatively bulky bandage and a splint. After removing the stitches, you will only have a splint to immobilize your thumb for a total of six weeks, from the date of surgery. This will keep the thumb stable while healing occurs. Once it is removed, the surgeon guides the movements to be made and will send the patient to a physiotherapist to help with mobility, making the new joint more flexible and the muscles stronger and more elastic. It will take some time before you regain full use of your thumb. Once regenerated, the patient will have little or no pain – as long as they do not exaggerate activities with the thumb. You have to ensure that you continue doing the exercises prescribed by your surgeon or hand therapist to improve the new joint. The thumb may never fully recover like a new finger, but you will be able to resume most of your daily tasks with virtually no complaints. //Prevention// In order to delay the progression of osteoarthritis, all measures that avoid overloading or misuse of the joint are essential. Osteoarthritis is one of the most disabling diseases of the bones and joints, but there are several reasons to exercise. Regaining mobility is one of them. Having a cast on your arm or leg helps you recover from fractures and reduces pain. Know what to do in this situation. A dislocation occurs when bones in a joint, such as the shoulder or knee, are displaced from their normal position. Learn about treatment options. About us;/ Events;/ Clients and Companions;/ News;/ CUF Academic Center;/ Partnerships;/ Contacts;/ Frequently Asked Questions;/ Join us;/ Virtual Visit;/ English version;/ My CUF;/ Access Solutions and Health Plans;/ Facebook;/ Facebook Instagram;/ Instagram LinkedInCreated with Sketch.;/ LinkedIn Youtube;/ Youtube award4;/ award4 certification1;/ certification1 certification2;/ certification2 certification3;/ certification3 Complaints and compliments;/ Complaints and compliments Privacy and Cookies Policy;/ Terms and Conditions;/ Whistleblower Channel;/ © CUF 2024 All rights reserved Home;/ Health A-Z: Diseases, Symptoms and Treatments;/"
