Doença,Detalhes
Bronchiolitis,"//What is it?// Bronchiolitis is an acute inflammation of the lower airways, very common in the first two years of life and predominantly in late autumn and winter. Bronchioles are the smallest and narrowest airways that communicate between the larger bronchi and the alveoli. The alveoli are the portion of the lungs where oxygen and carbon dioxide exchange occurs. The respiratory syncytial virus is the agent responsible for more than 70% of cases. Sometimes, in the same episode of acute bronchiolitis, one or more infectious agents may be involved. It is extremely contagious and transmission occurs through contact with contaminated respiratory secretions. Although coughing produces aerosols (small infected droplets) that children inhale, the most common mode of transmission is through hands that have infected secretions. Typically, children acquire the condition after being exposed to family members with the infection or sick children in kindergarten. As such, washing your hands before handling babies is one of the most important measures to reduce contagion. Acute bronchiolitis is characterized by an obstruction of small airways (bronchioles), making it difficult for air to enter the lungs. It mainly affects children under two years of age (maximum incidence between the first and sixth months of life). Most are infected by this virus and develop mild bronchiolitis, not requiring hospital care. The most serious cases (1% to 2% of cases) will have to be admitted to pediatric services. //Symptoms// Bronchiolitis usually begins with a runny nose and blocked nose, cough, with or without fever. After a period of two to three days, breathing difficulties appear, which worsen and are accompanied by wheezing (wheezing), irritability and refusal to eat. In younger children, acute bronchiolitis may manifest itself, at an early stage, through periods of apnea (breathing pauses). Rapid breathing or difficulty breathing in and out may also occur. //Causes// It is a viral infection. Most cases are benign and only 1% to 3.5% of all children with acute bronchiolitis require hospital admission. This percentage is higher in risk groups such as ex-premature babies, minors with chronic respiratory diseases, congenital heart disease, immunodeficiencies and those under the age of three and six months. There are also other factors that increase the risk of disease: masculine gender;/ exposure to tobacco smoke;/ feeding with breast milk for less than one or two months;/ low socioeconomic status;/ //Diagnosis// The diagnosis of bronchiolitis is mainly clinical. An important data to be valued in the physical examination is the measurement of oxygen saturation to assess the need for oxygen administration. Hypoxemia (low oxygen) is an important complication that requires hospital admission. If the progression of acute bronchiolitis is different from usual, it may be necessary to perform blood tests, chest X-rays or collection of secretions to search for viruses. //Treatment// Most acute bronchiolitis is mild and does not require specific treatment. Some helpful measures at home include: create a calm environment;/ avoid irritating factors, such as tobacco;/ raise the head of the bed to 30º;/ use of antipyretics if there is a fever (paracetamol or ibuprofen in babies over six months);/ clear the airways through frequent nasal washing with saline solution and/or suctioning of secretions;/ eat smaller meals at shorter intervals;/ maintain good hydration, giving water between meals;/ The administration of any cough syrup is contraindicated. Respiratory kinesiotherapy is not indicated in acute bronchiolitis because it does not alter the course of the disease and may even worsen it. Bronchodilators, if prescribed, must be administered with a pressurized inhaler associated with an expansion chamber and not with the “aerosol device” which is only recommended for use in specific cases and in the hospital. If breathing difficulties worsen, food refusal or other worrying signs appear, it is essential to consult a doctor. //Prevention// For some children included in the risk group, there are clinical guidelines that recommend prophylaxis with palivizumab, a vaccine to prevent infection by the respiratory syncytial virus. In all cases, to avoid contagion, measures such as the following are recommended: hand washing;/ limit contact with people with respiratory infections, particularly with siblings who attend kindergarten;/ avoid places with large concentrations of people, polluted areas and/or areas with tobacco smoke;/ Portuguese Lung Foundation, 2013 Manual Merck, 2014 Spanish Society of Pediatric Pulmonology, 2006 U.S. National Library of Medicine, agosto de 2013 Patrícia Mação et al., Acute Bronchiolitis, Prospective Study, Acta Med Port 2011; 24(S2): 407-412 Load more;/ RSV infection can progress to bronchiolitis or pneumonia. Mônica Cró Braz, Pediatrician, points out the warning signs and prevention strategies. The pandemic has brought pediatricians an additional concern: Respiratory Syncytial Virus. Since then, cases have appeared earlier, in greater numbers and with greater severity. In most cases, bronchiolitis resolves on its own and your baby will feel better within a few days, but there are cases that require hospitalization. About us;/ Events;/ Clients and Companions;/ News;/ CUF Academic Center;/ Partnerships;/ Contacts;/ Frequently Asked Questions;/ Join us;/ Virtual Visit;/ English version;/ My CUF;/ Access Solutions and Health Plans;/ Facebook;/ Facebook Instagram;/ Instagram LinkedInCreated with Sketch.;/ LinkedIn Youtube;/ Youtube award4;/ award4 certification1;/ certification1 certification2;/ certification2 certification3;/ certification3 Complaints and compliments;/ Complaints and compliments Privacy and Cookies Policy;/ Terms and Conditions;/ Whistleblower Channel;/ © CUF 2024 All rights reserved Home;/ Health A-Z: Diseases, Symptoms and Treatments;/"
Bronchitis,"//What is it?// Bronchitis is a process of inflammation of the main airways of the lungs (the bronchi), causing them to narrow, making breathing difficult and causing symptoms such as coughing. This process can be acute or chronic: acute bronchitis occurs for a short period of time; In chronic cases, symptoms occur during most days of the month, over at least three months and in two consecutive years. In bronchitis, there is hypertrophy of the glands that produce mucus along the airways, which explains the productive cough typical of this disease. As the pathology progresses, airflow limitation increases and complications such as pulmonary emphysema may arise. In Portugal, this is a very common condition. According to a study carried out in the country, bronchitis increases in prevalence with age, being around 12.5% ​​in men and 10.2% in women aged between 75 and 84 years. In global terms, bronchitis affects around 3.7% of the Portuguese population. //Symptoms// The main manifestation of bronchitis is cough, which evolves from seasonal to constant, becoming mucopurulent with increasing frequency. Shortness of breath is another important symptom. Chest pain can result from coughing. In acute bronchitis, other symptoms may appear, such as sore throat, runny nose, headache, muscle pain and fatigue. Fever is not common and should make you think of pneumonia or another infection. //Causes// Bronchitis can be caused by infectious agents, such as viruses or bacteria, by tobacco consumption or by inhalation of dust or polluting agents. Some diseases, such as asthma, can be confused with bronchitis. Sinusitis, pharyngitis, tonsillitis or apneumonia can also cause similar conditions. Respiratory viruses are the most common cause, with tobacco consumption being the main cause of chronic bronchitis. In fact, smoking is responsible for about 85% to 90% of cases of chronic bronchitis and chronic obstructive pulmonary disease. Smoking inhibits the movement of respiratory cilia, essential for the elimination of debris and microorganisms, interferes with the function of immune system cells, causes hypertrophy of the glands that produce mucus and contributes to the narrowing of the airways. //Diagnosis// The description of symptoms and medical examination, including pulmonary auscultation, are the starting point for diagnosis. The most commonly used tests are chest X-rays. In some situations, it may be important to perform laboratory tests on sputum or perform respiratory function tests. //Treatment// It is important to know that most cases do not require the use of antibiotics to treat acute bronchitis. They will only be important if a bacterial infection is confirmed. The most important measures for your treatment are: drinking plenty of fluids;/ use of inhalers (in the case of asthma);/ rest;/ use aspirin or acetaminophen if there is a fever;/ creation of a humid atmosphere;/ It may be useful to use medications that help dissolve the mucus in sputum, but it is important to only use them under medical advice. It is essential not to smoke, avoid secondhand smoke and pollution and wash your hands frequently to avoid transmitting viruses or other infectious agents. //Prevention// In addition to the measures already mentioned, it is important to remember the role of influenza and pneumococcal vaccines in preventing bronchitis.  The first must be administered between October and December for all people who belong to risk groups; the second must be carried out on chronically ill people and on all people aged 65 or over every five years. Its administration can be carried out at any time of the year. U.S. Department of Health and Human Services, National Institutes of Health, 24 Jan. 2013 Medscape Reference, 2013-02-20 Definition and Epidemiology of Chronic Diseases, 2nd International Forum of the Chronic Ill, Carlos Matias Dias and Eleonora Paixão, National Institute of Health Dr. Ricardo Jorge / National School of Public Health, Lisbon, 04/30 - 05/01, 2010 Statistical Elements, General Information, Health/2008, Paulo Nogueira et al., General Directorate of Health, Lisbon, December/2010 COPD is a respiratory disease that can significantly limit quality of life. Bronchodilators are the drugs of choice to treat it. In most cases, bronchiolitis resolves on its own and your baby will feel better within a few days, but there are cases that require hospitalization. About us;/ Events;/ Clients and Companions;/ News;/ CUF Academic Center;/ Partnerships;/ Contacts;/ Frequently Asked Questions;/ Join us;/ Virtual Visit;/ English version;/ My CUF;/ Access Solutions and Health Plans;/ Facebook;/ Facebook Instagram;/ Instagram LinkedInCreated with Sketch.;/ LinkedIn Youtube;/ Youtube award4;/ award4 certification1;/ certification1 certification2;/ certification2 certification3;/ certification3 Complaints and compliments;/ Complaints and compliments Privacy and Cookies Policy;/ Terms and Conditions;/ Whistleblower Channel;/ © CUF 2024 All rights reserved Home;/ Health A-Z: Diseases, Symptoms and Treatments;/"
Bruxism,"//What is it?// Bruxism is a disorder characterized by involuntary clenching and grinding of the teeth, applying excessive force to the chewing muscles, causing wear to the teeth that can affect their integrity and compromise oral health. Two distinct forms of bruxism can be considered: daytime and nighttime. The first is characterized by a semi-voluntary activity of the jaw, with the clenching of the teeth while the individual is awake and where grinding generally does not occur, being related to a tic, habit or a reaction to stress. The second is an unconscious activity of grinding or clenching teeth, producing sounds, while sleeping. Sleep bruxism creates tension in the temporomaxillary joints, which can wear them out and cause headaches. It also causes wear on teeth that can affect their integrity and compromise oral health. Sleep bruxism is a problem that mainly affects children but can also affect adults. It is estimated that the prevalence of bruxism is 20% in adults, and nocturnal bruxism, according to reports from family members, occurs in around 8% of the population. It is also believed that around 100,000 people in Portugal are affected by this condition. //Symptoms// The main symptoms are headaches, discomfort in the temporomandibular joint, pain in the muscles of the face and earlobes, stiff shoulders, limited mouth opening movements and sleep disturbances. There is also wear and tear of tooth enamel or even fracture of teeth, inflammation of the gums, excessive tooth mobility and premature tooth loss. Headaches are the most common symptom, occurring three times more in people with bruxism than in others. In children, it is common to be associated with nasal obstruction and respiratory complaints resulting from hypertrophy of the tonsils and adenoids. It is also normal for changes in behavior and attention to occur in this scenario. //Causes// As for daytime sleepiness, its causes are not known, although stress and anxiety are considered to be risk factors. Some studies show that during nocturnal crises, there is an increase in cardiac, respiratory and muscular activity, which suggests that there is a relationship between sleep mechanisms and bruxism. People with this condition often have other sleep disorders, such as snoring, episodes of apnea (pauses in breathing), talking or hallucinations in the phase between sleeping and waking. Other associated factors are young age, high level of education, tobacco use, and caffeine or alcohol intake. The use of substances to help with sleep, depression and anxiety can alter sleep patterns and increase the risk of bruxism occurring. Stress and anxiety appear to be related to around 70% of cases of bruxism. //Diagnosis// During a dental appointment, several signs of bruxism may be visible, such as uneven tooth wear, cracks or fractures, and tooth or facial muscle sensitivity. A sleep study could help confirm the diagnosis. //Treatment// The consequences of nocturnal bruxism can be controlled by using a relaxation splint placed in the mouth that protects the teeth and reduces muscle activity. Correct articulation of the upper and lower teeth reduces friction between them and improves the quality of chewing. Therefore, monitoring by the dentist is always important. Sometimes there are behavioral therapeutic proposals, such as psychoanalysis, hypnosis and relaxation techniques. However, these still lack sufficient scientific validation. //Prevention// Preventing most episodes of bruxism involves reducing the child's anxiety levels, which can be achieved by trying to relax before bed, for example, by taking a warm bath, listening to calm music, or reading a book. In cases where anxiety cannot be reduced, it may be necessary to consult a dentist or pediatrician in order to carry out a more detailed assessment. Bruxism in childhood is usually outgrown by adolescence. Most children stop grinding and clenching their teeth when their baby teeth are replaced by permanent teeth. However, some continue to do so during adolescence, and if the cause is stress, the grinding will continue until the tension is relieved. In this condition, bruxism can be prevented by trying to talk to children or adolescents to understand their fears and anxieties, and helping them to deal with their problems. The Bruxism Association, 2013 Mayo Foundation for Medical Education and Research, Maio 2011 Cristiane Rufino de Macedo, Sleep bruxism, Rev. Dent. Press Orthodon. Facial Orthop., 2008, 13 (2): 18-22 Lavigne GJ e col., Bruxism physiology and pathology: an overview for clinicians, J Oral Rehabil. 2008 Jul;35(7):476-94   Load more;/ Wisdom teeth are the last to emerge and, in some cases, need to be removed. We brush our teeth every day, but that doesn't mean we've mastered the technique. Learn about some oral hygiene mistakes and how to correct them. Did you know that around 70% of Portuguese people are missing natural teeth? Implants improve quality of life by restoring chewing ability and aesthetics. About us;/ Events;/ Clients and Companions;/ News;/ CUF Academic Center;/ Partnerships;/ Contacts;/ Frequently Asked Questions;/ Join us;/ Virtual Visit;/ English version;/ My CUF;/ Access Solutions and Health Plans;/ Facebook;/ Facebook Instagram;/ Instagram LinkedInCreated with Sketch.;/ LinkedIn Youtube;/ Youtube award4;/ award4 certification1;/ certification1 certification2;/ certification2 certification3;/ certification3 Complaints and compliments;/ Complaints and compliments Privacy and Cookies Policy;/ Terms and Conditions;/ Whistleblower Channel;/ © CUF 2024 All rights reserved Home;/ Health A-Z: Diseases, Symptoms and Treatments;/"
Bulimia,"//What is it?// Bulimia nervosa is a potentially serious eating disorder characterized by the secretive ingestion of large quantities of food, followed by induction of vomiting. In other cases, an attempt is made to compensate for excessive calorie intake with excessively intensive levels of exercise or by using diuretics and laxatives. The urge to expel food can become so intense that it is induced even after a light meal. After episodes of binge eating, patients tend to feel guilty and anxious for not having been able to control their impulsiveness. The sensation of hunger, as it is felt in an aversive way, leads to these compulsive behaviors being experienced with extreme shame, which may lead to their concealment. Bulimia nervosa can be of the purging type, when the patient regularly induces vomiting or uses laxatives, diuretics or enemas, or of the non-purging type, when the patient uses other compensatory behaviors such as fasting or excessive physical exercise. These patients are extremely rigid about their body image and weight management. It is quite common for these patients to have recurring thoughts about food and to have an extremely rigid ideal of thinness. It is estimated that bulimia nervosa affects around 13 out of every 100,000 people annually. Its incidence in women aged 15 to 24 – the highest risk group – has increased over the last 50 years. Some studies suggest that in endangered populations (generally female students) the frequency is around 10%. If we consider teenagers or young women in general, this value is lower and is around 1% to 3%. Bulimia, similar to anorexia nervosa, is related to the perception of body image. //Symptoms// Bulimia manifests itself through excessive concern about the body and weight, a constant fear of gaining weight, feeling unable to control eating behavior, eating until discomfort or pain occurs, inducing vomiting after eating or exercising excessively, inappropriate use of laxatives, diuretics and enemas or use of dietary supplements to lose weight. When bulimia is not properly controlled, complications can arise, such as dehydration, kidney failure, heart problems, menstrual irregularities, tooth and gum deterioration, digestive problems, anxiety, depression and alcohol and/or drug abuse. //Causes// Its exact cause is unknown. Multiple biological, emotional and social factors probably contribute to this condition. The main signs of risk are: Gender: female;/ Age: adolescence and young adults;/ Heredity: greater risk when there are first-degree relatives with eating disorders;/ Psychological and emotional aspects: reduced self-esteem, perfectionism, impulsive behavior, depression, anxiety or presence of an obsessive-compulsive disorder;/ Social Pressure: exerted by close people and the media, especially on young women. People with professions in contact with the public are at greater risk of developing disorders such as bulimia;/ Pressure resulting from sports practice: coaches and family members can, unintentionally, contribute to this situation by encouraging the athlete to lose weight and restrict their diet in favor of better sports performance;/ //Diagnosis// Early diagnosis is important but not always possible. Many patients are of normal weight, which makes it difficult to identify the problem. Generally, to identify bulimia, a medical examination, blood and urine tests, a psychological evaluation and other tests are necessary to rule out similar pathologies. It is considered to be bulimia when the following elements are present at least twice a week for at least three months: repeated episodes of eating large amounts of food with a feeling of inability to control this urge;/ elimination of excess calories through vomiting;/ too much physical exercise;/ fasting or use of diuretics or laxatives;/ excessive influence of weight and body shape on self-esteem;/ exclusion of the diagnosis of anorexia;/ //Treatment// Generally speaking, treatment requires a combination of medication and psychotherapy. In addition to these clinical elements, family support is a fundamental aspect in overcoming this disorder. At the pharmacological level, the most used medications are antidepressants, especially fluoxetine. Proper nutritional monitoring is important to ensure good eating habits, to achieve a healthy weight and to correct imbalances resulting from bulimia. Hospitalization may rarely be necessary. Although symptoms often improve, recovery is sometimes not complete and periods of excessive food intake and subsequent elimination may occur, triggered by everyday events or stress. In these patients, periodic medical or psychological monitoring may be recommended. Through psychological intervention in bulimia nervosa, the patient will be able to develop a regular and flexible eating plan that includes previously avoided foods. Over the course of the intervention, the aim is for the patient to be able to deal with risk situations for compulsive food intake and vomiting. In order for the patient to learn to reduce concerns about their body and weight, attempts will be made to modify maladaptive thoughts, attitudes and emotions related to eating behavior. After the patient improves, the intervention will have as its central objective the prevention of possible factors that could generate a relapse. //Prevention// Prevention involves maintaining healthy lifestyle habits and identifying any signs of this condition early. In younger people, regular pediatric evaluation allows for early identification of eating disorders. Creating an adequate perception of body image by children, through parents, also plays a very important role in preventing bulimia. Mayo Foundation for Medical Education and Research, Abril 2012 Paulo P. P. Machado et al., Eating Disorders in Portugal: Patterns of Service Use, NDCA Scientific Information and Dissemination Magazine, 1 (1), January-March, 2004: 1-8 Maria dos Anjos Dixe, Prevalence of Eating Disorders, Psychological Analysis (2007), 4 (XXV): 559-569 Load more;/ Inducing vomiting is an alarm sign that should prompt parents to seek medical advice. But there are more diseases of eating behavior. Get to know them. It is necessary to understand the reasons that lead to the absence of menstruation in a woman of childbearing age, as amenorrhea can be a symptom of a health problem. Pediatrics follows the child from birth to the end of adolescence. Ana Marques and Marta Albuquerque Pinto, pediatricians at CUF, explain what changes in the monitoring. About us;/ Events;/ Clients and Companions;/ News;/ CUF Academic Center;/ Partnerships;/ Contacts;/ Frequently Asked Questions;/ Join us;/ Virtual Visit;/ English version;/ My CUF;/ Access Solutions and Health Plans;/ Facebook;/ Facebook Instagram;/ Instagram LinkedInCreated with Sketch.;/ LinkedIn Youtube;/ Youtube award4;/ award4 certification1;/ certification1 certification2;/ certification2 certification3;/ certification3 Complaints and compliments;/ Complaints and compliments Privacy and Cookies Policy;/ Terms and Conditions;/ Whistleblower Channel;/ © CUF 2024 All rights reserved Home;/ Health A-Z: Diseases, Symptoms and Treatments;/"
