Doença,Detalhes
Arthritis arthrosis of the hand and wrist,"//What is it?// It is an inflammation that affects the different elements that make up a joint (the area where two or more bones meet and which allows movements to be carried out).  It manifests with pain localized to the affected joint, accompanied by decreased movement of the same joint and typically worsens with age.  The most common arthritis are osteoarthritis and rheumatoid arthritis. In osteoarthritis, the cartilage, which is the covering of the bones in the joint areas and which allows them to slide to carry out movement, suffers wear and tear and even disappears. Rheumatoid arthritis is a disease in which the body attacks the inner lining of the joints. //Symptoms// Affected joints present: Dor;/ Rigidity with decreased total movement of the same;/ Edema (swelling);/ Redness;/ Heat;/ Joint deformity (in advanced cases);/ //Causes// The two most common causes of arthritis damage the joint differently.  Osteoarthritis: in this situation, there is wear and tear of the cartilage, the covering present at the ends of the bones in the joint areas. This covering allows the bones not only to slide harmoniously, producing movement, but also the distribution and dissipation of energy generated in movements of greater intensity, such as jumping, thus preventing injuries. If this covering deteriorates, which occurs over the years or following fractures involving the bones in the joint areas, severe sprains or joint infections, the bone begins to rub against the bone, causing pain and reduced movement of the joint involved.  Rheumatoid arthritis: In this disease, the organism attacks the tissue that lines the inside of the joints (it is called the synovial membrane and is equivalent to paint on the wall of a room).  This membrane then becomes inflamed, red and swollen. As membrane inflammation increases, which happens as the disease progresses, cartilage and bone are gradually destroyed.  Risk factors for arthritis are:  Family history: Some types of arthritis have a familial component, which means that if parents or siblings suffer from the disease there is a greater risk than the general population of developing it.  Age: The risk of developing most arthritis types increases with age.  Sex: Rheumatoid arthritis affects women more frequently, gout in turn affects men more.  Previous joint injuries: Any joint that has suffered a fracture or a severe sprain suffers early wear and tear, sooner or later developing into osteoarthritis.  Obesity: Increased weight on a joint causes premature wear, especially on the joints that support it such as knees, hips, ankles and spine, which is why obesity is directly related to arthritis. //Diagnosis// Diagnosis is made by observing the joints, looking for swelling, redness, heat and evaluating movement.  The medical evaluation can be completed with tests (of the blood or even the fluid present in the joint) and X-ray (where it is possible to identify the loss of cartilage, bone destruction and the formation of osteophytes, commonly called “parrot beaks”).  It may be necessary, not for diagnosis but for defining the treatment plan, to perform computed tomography (CT), magnetic resonance imaging or ultrasound. //Treatment// Treatment depends on the type of arthritis and the goal is to relieve symptoms and improve quality of life.  Medication: There are several medications available for controlling pain and inflammation. They can be used as definitive treatment if they meet the treatment objectives by allowing the patient to carry out day-to-day activities without complaints or with only residual complaints.  Physiotherapy: This can provide relief in some types of arthritis, especially by reducing the inflammatory process and promoting muscle strengthening. During the course of treatment, splints may be used to rest the joint.  Surgery: If conservative treatment (medication and physiotherapy) does not work, surgery is recommended. Surgical options are adapted to the pathology present and the patient and are: Joint lavage: Usually performed with 2 to 4 small incisions that allow the placement of instruments inside the joint through which it is possible to proceed to wash the joint, remove loose bodies (fragments of cartilage that have come loose) and inflammatory tissue. Valid option in the initial stages of arthritis or as a way of postponing a more aggressive surgical procedure.;/ Joint replacement (arthroplasty): In this method, damaged surfaces are removed and replaced with a prosthesis or spacer (artificial or constructed from the patient's own tendon) in order to eliminate pain and preserve the movement.;/ Joint fusion (arthrodesis): This technique eliminates the joint by removing the ends of the two bones and establishing the union of the two bones by placing plates and/or screws. By eliminating the movement of the joint, the pain caused by the movement disappears. Inevitably, this technique eliminates the movement of the blocked joint, but allows the use of the hand and arm.;/ Load more;/ Winter is synonymous with low temperatures, which can be accompanied by health problems. Learn how to reduce risks. Juvenile idiopathic arthritis is the most common type of arthritis in children. Although chronic, treatment allows a normal life, especially when detected early. Do you have psoriasis or family members with this disease? So, it is possible that you will suffer from psoriatic arthritis. Know how to recognize the symptoms. About us;/ Events;/ Clients and Companions;/ News;/ CUF Academic Center;/ Partnerships;/ Contacts;/ Frequently Asked Questions;/ Join us;/ Virtual Visit;/ English version;/ My CUF;/ Access Solutions and Health Plans;/ Facebook;/ Facebook Instagram;/ Instagram LinkedInCreated with Sketch.;/ LinkedIn Youtube;/ Youtube award4;/ award4 certification1;/ certification1 certification2;/ certification2 certification3;/ certification3 Complaints and compliments;/ Complaints and compliments Privacy and Cookies Policy;/ Terms and Conditions;/ Whistleblower Channel;/ © CUF 2024 All rights reserved Home;/ Health A-Z: Diseases, Symptoms and Treatments;/"
Juvenile idiopathic arthritis,"//What is it?// Juvenile Idiopathic Arthritis (JIA) constitutes a heterogeneous group of diseases that began before the age of 16, characterized by the presence of arthritis of one or more joints, persisting for at least six weeks. They are one of the most common chronic diseases in children and adolescents, being an important cause of disability, eye disease and academic failure, due to the absenteeism they can cause. //Symptoms// Symptoms vary depending on the type of JIA and may include: Pain, swelling, heat and tenderness in the joints;/ Morning joint stiffness;/ Coxear;/ Fever;/ Rash;/ Weight loss;/ Swollen lymph nodes;/ Fatigue or irritability;/ Red eye, eye pain, blurred vision;/ //Causes// The causes of JIA are not known. Factors that may be involved, alone or in combination, include genetic (hereditary) factors and factors that influence the immune system. //Diagnosis// Diagnosis involves ruling out other causes of arthritis and other diseases that cause symptoms; You may also need: Imaging techniques, such as X-ray or MRI of the involved joints;/ Laboratory tests of blood, urine and/or joint fluid to determine the type of arthritis (especially ANA- antinuclear antibody and rheumatoid factor).;/ //Treatment// The goals of treatment are to relieve pain, reduce swelling, increase joint mobility and strength, and prevent complications. Treatment usually includes rehabilitation exercises and medications, including: Nonsteroidal anti-inflammatory drugs (NSAIDs) that provide pain relief and reduce swelling;/ Corticosteroids;/ Rheumatoid arthritis disease-modifying antirheumatic drugs (DMARDs): modify the progression of the disease, acting on the immune system to prevent the destruction of bones and joints.;/ Biotechnological therapeutics: act directly on the molecules or proteins of the immune system responsible for causing inflammation; they are used in adults and children with severe arthritis, through subcutaneous or intravenous injection;/ Adapted exercise and targeted physiotherapy reduce pain and contribute to maintaining muscle tone, improving mobility and preventing permanent disabilities.;/ //Prevention// Currently, as its cause is unknown, there is no way to prevent juvenile idiopathic arthritis. Cleveland Clinic Load more;/ Winter is synonymous with low temperatures, which can be accompanied by health problems. Learn how to reduce risks. Having a cast on your arm or leg helps you recover from fractures and reduces pain. Know what to do in this situation. A dislocation occurs when bones in a joint, such as the shoulder or knee, are displaced from their normal position. Learn about treatment options. About us;/ Events;/ Clients and Companions;/ News;/ CUF Academic Center;/ Partnerships;/ Contacts;/ Frequently Asked Questions;/ Join us;/ Virtual Visit;/ English version;/ My CUF;/ Access Solutions and Health Plans;/ Facebook;/ Facebook Instagram;/ Instagram LinkedInCreated with Sketch.;/ LinkedIn Youtube;/ Youtube award4;/ award4 certification1;/ certification1 certification2;/ certification2 certification3;/ certification3 Complaints and compliments;/ Complaints and compliments Privacy and Cookies Policy;/ Terms and Conditions;/ Whistleblower Channel;/ © CUF 2024 All rights reserved Home;/ Health A-Z: Diseases, Symptoms and Treatments;/"
Inflammatory arthritis,"//What is it?// Inflammatory arthritis is part of a group of diseases that affect the immune system and, therefore, the body's defense systems attack the body's own tissues instead of attacking microorganisms or external substances. These pathologies are known as autoimmune diseases. It corresponds to an inflammatory joint process characterized by the presence of joint effusion and/or pain on movement, heat, redness and functional limitation. In general, its signs and symptoms last up to six weeks. It can affect only one joint (monoarthritis), less than five (oligoarthritis) or more than five (polyarthritis). The most common inflammatory arthritis are rheumatoid arthritis, ankylosing spondylitis and arthritis associated with psoriasis. These diseases can affect men, women and children at any age and affect other parts of the body. However, in the case of rheumatoid arthritis, 75% of patients are female and it occurs most frequently between the ages of 25 and 50. Systemic lupus erythematosus is also more common in women. On the other hand, psoriatic arthritis and ankylosing spondylitis are more common in younger populations. Inflammatory arthritis is not curable but its prognosis has improved in the last 20/30 years. There are new treatments that are started earlier, thus reducing joint damage, the need for surgery and the number of complications. It is important not to confuse inflammatory arthritis with osteoarthritis, which is a degenerative process that occurs when cartilage and/or ligaments wear out. When these structures are damaged, the muscles surrounding them contract to protect the joint. When this mechanism is not effective, the bone around the joint grows, forming spurs that attempt to stabilize the joint. In the case of inflammatory arthritis, the challenges faced by patients are physical (pain, disability, fatigue, damage to joints and organs) and emotional (depression, frustration, anxiety). //Symptoms// Many people with inflammatory arthritis do not have any signs of disease. Increased blood flow and the release of chemicals attract white blood cells to the site of inflammation. These events cause irritation, joint wear and swelling. The most common symptoms are redness, swelling of the joints that become painful and tender to the touch, joint pain and stiffness, and loss of function of the joints involved. As a general illness, fever, chills, fatigue and loss of energy, headaches and loss of appetite may occur. If the inflammation affects other organs, the symptoms may vary. If it occurs in the myocardium, there will be chest pain or fluid retention; if it involves the bronchial tree, there will be difficulty breathing; if it affects the kidneys, there may be hypertension or renal failure; in the case of the visual system, the patient may feel pain and decreased vision; if it affects the muscles, it will cause pain and muscle weakness; if it involves the blood vessels, there may be vasculitis, with manifestations in the skin or damage to other deeper organs. Pain is not always present because many organs do not have pain-sensitive nerves. //Causes// In general, the cause is unknown, and it is thought that its origins are inflammatory or autoimmune factors. The role of genetics is still unclear. When the inflammatory process occurs, chemicals are released that reach various tissues. This release tends to increase blood flow to the affected area, which can cause heat and redness. The associated swelling can stimulate some nerves, causing pain. //Diagnosis// Diagnosis involves a medical examination, with emphasis on the location of the affected joints, the presence of morning stiffness and complaints in other organs, and these elements should be complemented by radiological and laboratory tests. //Treatment// There are several options, including rest and surgery. The type of treatment will depend on several factors, such as the type of disease, the patient's age, current medications, general health and the severity of symptoms. The main objectives are to avoid or modify activities that aggravate the suffering, to use anti-inflammatory or analgesic medications to control pain and inflammation and to reduce the pressure exerted on the affected joints by using immobilization or support systems, whenever necessary. The most common therapy is that which reduces inflammation and swelling and which prevents or minimizes the progression of the disease itself. The most commonly used are aspirin, ibuprofen, corticosteroids and medications such as those used in chemotherapy, biological therapies or narcotic drugs for pain relief. The role of early rehabilitation is essential and may include physical therapy, joint protection, and exercises to restore strength and flexibility. //Prevention// If there is no specific cause, prevention is more difficult. However, regular physical exercise adapted to the age and conditions of each person, a balanced diet, adequate weight control, are good examples of measures that can help prevent the various forms of arthritis. Arthritis Research UK, 2013 WebMD, 2012 Lesko M. e col., Managing inflammatory arthritides: Role of the nurse practitioner and physician assistant. Journal of the American Academy of Nurse Practitioners, 382–392, July 2010 National Center for Biotechnology Information, U.S. National Library of Medicine, 2013 Load more;/ Winter is synonymous with low temperatures, which can be accompanied by health problems. Learn how to reduce risks. Juvenile idiopathic arthritis is the most common type of arthritis in children. Although chronic, treatment allows a normal life, especially when detected early. Do you have psoriasis or family members with this disease? So, it is possible that you will suffer from psoriatic arthritis. Know how to recognize the symptoms. About us;/ Events;/ Clients and Companions;/ News;/ CUF Academic Center;/ Partnerships;/ Contacts;/ Frequently Asked Questions;/ Join us;/ Virtual Visit;/ English version;/ My CUF;/ Access Solutions and Health Plans;/ Facebook;/ Facebook Instagram;/ Instagram LinkedInCreated with Sketch.;/ LinkedIn Youtube;/ Youtube award4;/ award4 certification1;/ certification1 certification2;/ certification2 certification3;/ certification3 Complaints and compliments;/ Complaints and compliments Privacy and Cookies Policy;/ Terms and Conditions;/ Whistleblower Channel;/ © CUF 2024 All rights reserved Home;/ Health A-Z: Diseases, Symptoms and Treatments;/"
Rheumatoid arthritis,"//What is it?// Rheumatoid arthritis is an inflammatory rheumatic disease that manifests itself in the form of polyarthritis (defined by the involvement of three or more joints), bilateral (affecting joints on both sides of the body), symmetrical (affecting the same joints on both sides of the body). progressive, destructive and deforming. This evolution culminates, after 10 to 20 years of evolution of the pathology, particularly in patients with a partial response to treatments, in some degree of motor disability. In Portugal, rheumatoid arthritis is the most prevalent inflammatory rheumatic disease, affecting around 0.3% to 0.4% of the Portuguese population. //Symptoms// The clinical presentation of rheumatoid arthritis is variable, with the disease beginning acutely or slowly, or between these two extremes, subacutely. A slow or gradual onset is more common (about 2/3 of cases), while an acute onset is less common. It begins predominantly as a joint disease, with one or more joints affected, most frequently the small joints of the hands and feet, bilaterally and symmetrically, although it may initially manifest as an extra-articular disease or with a non-articular presentation, or even predominantly general, with diffuse inflammatory joint or muscular pain. In the articular picture, there is often, from the beginning of the disease, fatigue, anorexia, weight loss and low fever. In other cases, months before the onset of polyarthritis, isolated fatigue or non-specific diffuse pain may occur, accompanied by lung disease. //Causes// The cause of rheumatoid arthritis is unknown, however several risk factors have been identified, such as infections, genetics and hormonal changes. It is an autoimmune disease, which means that the body's defenses attack its own tissues. Rheumatoid arthritis can occur at any time of life but is more common in middle age. The individual's gender affects susceptibility to the disease, so it is approximately two to three times more common in women. //Diagnosis// The diagnosis of rheumatoid arthritis is made by the rheumatologist and other clinicians with experience in observing these patients, immediately and “at the entrance to the office”, based on a quick observation of the hands, which present typical joint deformities. In fact, the hands of a rheumatic patient offer so much information regarding their illness that they can be considered their calling card. However, diagnosing its early and initial symptoms, as well as its atypical forms, are a challenge. As there is no single clinical, radiological or serological test that allows a conclusive diagnosis, it is carried out based on the clinical combination (characteristic signs and symptoms), as well as laboratory and radiological data. Although in some patients all tests may be normal. //Treatment// It is a pathology that requires lifelong treatment, including the use of medication, physiotherapy, exercise and surgery. It is equally important to assess the presence of food allergies and aim for a balanced diet, rich in omega-3 acids. Within drugs, there are several classes that can be used depending on the clinical condition of each patient. The earlier the treatment of rheumatoid arthritis, the more it will be possible to delay joint destruction. //Prevention// There is no information on how to prevent rheumatoid arthritis, as this disease results from a combination of genetic, immunological and environmental factors. However, early diagnosis and treatment, as well as the adoption of non-pharmacological measures, are essential in preventing RA complications. The factor whose association with the disease is confirmed is smoking - numerous studies link tobacco consumption with an increased risk and increased severity of rheumatoid arthritis. National Center for Biotechnology Information, U.S. National Library of Medicine;/ Medscape Reference(http://emedicine.medscape.com);/ Portuguese Society of Rheumatology;/ Load more;/ Limited movement and pain from rheumatoid arthritis are some of the symptoms these patients have to deal with. But there are ways to mitigate them. Winter is synonymous with low temperatures, which can be accompanied by health problems. Learn how to reduce risks. Juvenile idiopathic arthritis is the most common type of arthritis in children. Although chronic, treatment allows a normal life, especially when detected early. About us;/ Events;/ Clients and Companions;/ News;/ CUF Academic Center;/ Partnerships;/ Contacts;/ Frequently Asked Questions;/ Join us;/ Virtual Visit;/ English version;/ My CUF;/ Access Solutions and Health Plans;/ Facebook;/ Facebook Instagram;/ Instagram LinkedInCreated with Sketch.;/ LinkedIn Youtube;/ Youtube award4;/ award4 certification1;/ certification1 certification2;/ certification2 certification3;/ certification3 Complaints and compliments;/ Complaints and compliments Privacy and Cookies Policy;/ Terms and Conditions;/ Whistleblower Channel;/ © CUF 2024 All rights reserved Home;/ Health A-Z: Diseases, Symptoms and Treatments;/"
